fk_industry_group,code,concept_name,source,standard_semantic_hierarchy
Administration of Environmental Quality Programs ,9241,NAICS Industry Group Code,2022 NAICS,No
"Administration of Housing Programs, Urban Planning, and Community Development ",9251,NAICS Industry Group Code,2022 NAICS,No
Administration of Economic Programs ,9261,NAICS Industry Group Code,2022 NAICS,No
Space Research and Technology ,9271,NAICS Industry Group Code,2022 NAICS,No
National Security and International Affairs ,9281,NAICS Industry Group Code,2022 NAICS,No
