name,parent,concept_name,source,standard_semantic_hierarchy
Soybean Farming,Oilseed and Grain Farming,NAICS Industry,2022 NAICS,Yes
Oilseed (except Soybean) Farming,Oilseed and Grain Farming,NAICS Industry,2022 NAICS,Yes
Dry Pea and Bean Farming,Oilseed and Grain Farming,NAICS Industry,2022 NAICS,Yes
Wheat Farming,Oilseed and Grain Farming,NAICS Industry,2022 NAICS,Yes
Corn Farming,Oilseed and Grain Farming,NAICS Industry,2022 NAICS,Yes
Rice Farming,Oilseed and Grain Farming,NAICS Industry,2022 NAICS,Yes
Other Grain Farming,Oilseed and Grain Farming,NAICS Industry,2022 NAICS,Yes
Vegetable and Melon Farming,Vegetable and Melon Farming,NAICS Industry,2022 NAICS,Yes
Orange Groves,Fruit and Tree Nut Farming,NAICS Industry,2022 NAICS,Yes
Citrus (except Orange) Groves,Fruit and Tree Nut Farming,NAICS Industry,2022 NAICS,Yes
Noncitrus Fruit and Tree Nut Farming,Fruit and Tree Nut Farming,NAICS Industry,2022 NAICS,Yes
Food Crops Grown Under Cover,"Greenhouse, Nursery, and Floriculture Production",NAICS Industry,2022 NAICS,Yes
Nursery and Floriculture Production,"Greenhouse, Nursery, and Floriculture Production",NAICS Industry,2022 NAICS,Yes
Tobacco Farming,Other Crop Farming,NAICS Industry,2022 NAICS,Yes
Cotton Farming,Other Crop Farming,NAICS Industry,2022 NAICS,Yes
Sugarcane Farming,Other Crop Farming,NAICS Industry,2022 NAICS,Yes
Hay Farming,Other Crop Farming,NAICS Industry,2022 NAICS,Yes
All Other Crop Farming,Other Crop Farming,NAICS Industry,2022 NAICS,Yes
"Beef Cattle Ranching and Farming, including Feedlots",Cattle Ranching and Farming,NAICS Industry,2022 NAICS,Yes
Dairy Cattle and Milk Production,Cattle Ranching and Farming,NAICS Industry,2022 NAICS,Yes
Dual-Purpose Cattle Ranching and Farming,Cattle Ranching and Farming,NAICS Industry,2022 NAICS,Yes
Hog and Pig Farming,Hog and Pig Farming,NAICS Industry,2022 NAICS,Yes
Chicken Egg Production,Poultry and Egg Production,NAICS Industry,2022 NAICS,Yes
Broilers and Other Meat Type Chicken Production,Poultry and Egg Production,NAICS Industry,2022 NAICS,Yes
Turkey Production,Poultry and Egg Production,NAICS Industry,2022 NAICS,Yes
Poultry Hatcheries,Poultry and Egg Production,NAICS Industry,2022 NAICS,Yes
Other Poultry Production,Poultry and Egg Production,NAICS Industry,2022 NAICS,Yes
Sheep Farming,Sheep and Goat Farming,NAICS Industry,2022 NAICS,Yes
Goat Farming,Sheep and Goat Farming,NAICS Industry,2022 NAICS,Yes
Aquaculture,Aquaculture,NAICS Industry,2022 NAICS,Yes
Apiculture,Other Animal Production,NAICS Industry,2022 NAICS,Yes
Horses and Other Equine Production,Other Animal Production,NAICS Industry,2022 NAICS,Yes
Fur-Bearing Animal and Rabbit Production,Other Animal Production,NAICS Industry,2022 NAICS,Yes
All Other Animal Production,Other Animal Production,NAICS Industry,2022 NAICS,Yes
Timber Tract Operations,Timber Tract Operations,NAICS Industry,2022 NAICS,Yes
Forest Nurseries and Gathering of Forest Products,Forest Nurseries and Gathering of Forest Products,NAICS Industry,2022 NAICS,Yes
Logging,Logging,NAICS Industry,2022 NAICS,Yes
Fishing,Fishing,NAICS Industry,2022 NAICS,Yes
Hunting and Trapping,Hunting and Trapping,NAICS Industry,2022 NAICS,Yes
Support Activities for Crop Production,Support Activities for Crop Production,NAICS Industry,2022 NAICS,Yes
Support Activities for Animal Production,Support Activities for Animal Production,NAICS Industry,2022 NAICS,Yes
Support Activities for Forestry,Support Activities for Forestry,NAICS Industry,2022 NAICS,Yes
Crude Petroleum Extraction ,Oil and Gas Extraction,NAICS Industry,2022 NAICS,Yes
Natural Gas Extraction ,Oil and Gas Extraction,NAICS Industry,2022 NAICS,Yes
Coal Mining,Coal Mining,NAICS Industry,2022 NAICS,Yes
Iron Ore Mining,Metal Ore Mining,NAICS Industry,2022 NAICS,Yes
Gold Ore and Silver Ore Mining,Metal Ore Mining,NAICS Industry,2022 NAICS,Yes
"Copper, Nickel, Lead, and Zinc Mining",Metal Ore Mining,NAICS Industry,2022 NAICS,Yes
Other Metal Ore Mining,Metal Ore Mining,NAICS Industry,2022 NAICS,Yes
Stone Mining and Quarrying,Nonmetallic Mineral Mining and Quarrying,NAICS Industry,2022 NAICS,Yes
"Sand, Gravel, Clay, and Ceramic and Refractory Minerals Mining and Quarrying",Nonmetallic Mineral Mining and Quarrying,NAICS Industry,2022 NAICS,Yes
Other Nonmetallic Mineral Mining and Quarrying,Nonmetallic Mineral Mining and Quarrying,NAICS Industry,2022 NAICS,Yes
Support Activities for Mining,Support Activities for Mining,NAICS Industry,2022 NAICS,Yes
Electric Power Generation ,"Electric Power Generation, Transmission and Distribution",NAICS Industry,2022 NAICS,Yes
"Electric Power Transmission, Control, and Distribution ","Electric Power Generation, Transmission and Distribution",NAICS Industry,2022 NAICS,Yes
Natural Gas Distribution ,Natural Gas Distribution ,NAICS Industry,2022 NAICS,Yes
Water Supply and Irrigation Systems ,"Water, Sewage and Other Systems ",NAICS Industry,2022 NAICS,Yes
Sewage Treatment Facilities ,"Water, Sewage and Other Systems ",NAICS Industry,2022 NAICS,Yes
Steam and Air-Conditioning Supply ,"Water, Sewage and Other Systems ",NAICS Industry,2022 NAICS,Yes
Residential Building Construction,Residential Building Construction,NAICS Industry,2022 NAICS,Yes
Industrial Building Construction,Nonresidential Building Construction,NAICS Industry,2022 NAICS,Yes
Commercial and Institutional Building Construction,Nonresidential Building Construction,NAICS Industry,2022 NAICS,Yes
Water and Sewer Line and Related Structures Construction,Utility System Construction,NAICS Industry,2022 NAICS,Yes
Oil and Gas Pipeline and Related Structures Construction,Utility System Construction,NAICS Industry,2022 NAICS,Yes
Power and Communication Line and Related Structures Construction,Utility System Construction,NAICS Industry,2022 NAICS,Yes
Land Subdivision,Land Subdivision,NAICS Industry,2022 NAICS,Yes
"Highway, Street, and Bridge Construction","Highway, Street, and Bridge Construction",NAICS Industry,2022 NAICS,Yes
Other Heavy and Civil Engineering Construction,Other Heavy and Civil Engineering Construction,NAICS Industry,2022 NAICS,Yes
Poured Concrete Foundation and Structure Contractors ,"Foundation, Structure, and Building Exterior Contractors",NAICS Industry,2022 NAICS,Yes
Structural Steel and Precast Concrete Contractors ,"Foundation, Structure, and Building Exterior Contractors",NAICS Industry,2022 NAICS,Yes
Framing Contractors ,"Foundation, Structure, and Building Exterior Contractors",NAICS Industry,2022 NAICS,Yes
Masonry Contractors ,"Foundation, Structure, and Building Exterior Contractors",NAICS Industry,2022 NAICS,Yes
Glass and Glazing Contractors ,"Foundation, Structure, and Building Exterior Contractors",NAICS Industry,2022 NAICS,Yes
Roofing Contractors ,"Foundation, Structure, and Building Exterior Contractors",NAICS Industry,2022 NAICS,Yes
Siding Contractors ,"Foundation, Structure, and Building Exterior Contractors",NAICS Industry,2022 NAICS,Yes
"Other Foundation, Structure, and Building Exterior Contractors ","Foundation, Structure, and Building Exterior Contractors",NAICS Industry,2022 NAICS,Yes
Electrical Contractors and Other Wiring Installation Contractors,Building Equipment Contractors,NAICS Industry,2022 NAICS,Yes
"Plumbing, Heating, and Air-Conditioning Contractors",Building Equipment Contractors,NAICS Industry,2022 NAICS,Yes
Other Building Equipment Contractors,Building Equipment Contractors,NAICS Industry,2022 NAICS,Yes
Drywall and Insulation Contractors,Building Finishing Contractors,NAICS Industry,2022 NAICS,Yes
Painting and Wall Covering Contractors,Building Finishing Contractors,NAICS Industry,2022 NAICS,Yes
Flooring Contractors,Building Finishing Contractors,NAICS Industry,2022 NAICS,Yes
Tile and Terrazzo Contractors,Building Finishing Contractors,NAICS Industry,2022 NAICS,Yes
Finish Carpentry Contractors,Building Finishing Contractors,NAICS Industry,2022 NAICS,Yes
Other Building Finishing Contractors,Building Finishing Contractors,NAICS Industry,2022 NAICS,Yes
Site Preparation Contractors,Other Specialty Trade Contractors,NAICS Industry,2022 NAICS,Yes
All Other Specialty Trade Contractors,Other Specialty Trade Contractors,NAICS Industry,2022 NAICS,Yes
Animal Food Manufacturing,Animal Food Manufacturing,NAICS Industry,2022 NAICS,Yes
Flour Milling and Malt Manufacturing,Grain and Oilseed Milling,NAICS Industry,2022 NAICS,Yes
Starch and Vegetable Fats and Oils Manufacturing,Grain and Oilseed Milling,NAICS Industry,2022 NAICS,Yes
Breakfast Cereal Manufacturing,Grain and Oilseed Milling,NAICS Industry,2022 NAICS,Yes
Sugar Manufacturing,Sugar and Confectionery Product Manufacturing,NAICS Industry,2022 NAICS,Yes
Nonchocolate Confectionery Manufacturing,Sugar and Confectionery Product Manufacturing,NAICS Industry,2022 NAICS,Yes
Chocolate and Confectionery Manufacturing,Sugar and Confectionery Product Manufacturing,NAICS Industry,2022 NAICS,Yes
Frozen Food Manufacturing,Fruit and Vegetable Preserving and Specialty Food Manufacturing,NAICS Industry,2022 NAICS,Yes
"Fruit and Vegetable Canning, Pickling, and Drying",Fruit and Vegetable Preserving and Specialty Food Manufacturing,NAICS Industry,2022 NAICS,Yes
Dairy Product (except Frozen) Manufacturing,Dairy Product Manufacturing,NAICS Industry,2022 NAICS,Yes
Ice Cream and Frozen Dessert Manufacturing,Dairy Product Manufacturing,NAICS Industry,2022 NAICS,Yes
Animal Slaughtering and Processing,Animal Slaughtering and Processing,NAICS Industry,2022 NAICS,Yes
Seafood Product Preparation and Packaging,Seafood Product Preparation and Packaging,NAICS Industry,2022 NAICS,Yes
Bread and Bakery Product Manufacturing,Bakeries and Tortilla Manufacturing,NAICS Industry,2022 NAICS,Yes
"Cookie, Cracker, and Pasta Manufacturing",Bakeries and Tortilla Manufacturing,NAICS Industry,2022 NAICS,Yes
Tortilla Manufacturing,Bakeries and Tortilla Manufacturing,NAICS Industry,2022 NAICS,Yes
Snack Food Manufacturing,Other Food Manufacturing,NAICS Industry,2022 NAICS,Yes
Coffee and Tea Manufacturing,Other Food Manufacturing,NAICS Industry,2022 NAICS,Yes
Flavoring Syrup and Concentrate Manufacturing,Other Food Manufacturing,NAICS Industry,2022 NAICS,Yes
Seasoning and Dressing Manufacturing,Other Food Manufacturing,NAICS Industry,2022 NAICS,Yes
All Other Food Manufacturing,Other Food Manufacturing,NAICS Industry,2022 NAICS,Yes
Soft Drink and Ice Manufacturing,Beverage Manufacturing,NAICS Industry,2022 NAICS,Yes
Breweries,Beverage Manufacturing,NAICS Industry,2022 NAICS,Yes
Wineries,Beverage Manufacturing,NAICS Industry,2022 NAICS,Yes
Distilleries,Beverage Manufacturing,NAICS Industry,2022 NAICS,Yes
Tobacco Manufacturing,Tobacco Manufacturing,NAICS Industry,2022 NAICS,Yes
"Fiber, Yarn, and Thread Mills","Fiber, Yarn, and Thread Mills",NAICS Industry,2022 NAICS,Yes
Broadwoven Fabric Mills,Fabric Mills,NAICS Industry,2022 NAICS,Yes
Narrow Fabric Mills and Schiffli Machine Embroidery,Fabric Mills,NAICS Industry,2022 NAICS,Yes
Nonwoven Fabric Mills,Fabric Mills,NAICS Industry,2022 NAICS,Yes
Knit Fabric Mills,Fabric Mills,NAICS Industry,2022 NAICS,Yes
Textile and Fabric Finishing Mills,Textile and Fabric Finishing and Fabric Coating Mills,NAICS Industry,2022 NAICS,Yes
Fabric Coating Mills,Textile and Fabric Finishing and Fabric Coating Mills,NAICS Industry,2022 NAICS,Yes
Carpet and Rug Mills,Textile Furnishings Mills,NAICS Industry,2022 NAICS,Yes
Curtain and Linen Mills,Textile Furnishings Mills,NAICS Industry,2022 NAICS,Yes
Textile Bag and Canvas Mills,Other Textile Product Mills,NAICS Industry,2022 NAICS,Yes
All Other Textile Product Mills,Other Textile Product Mills,NAICS Industry,2022 NAICS,Yes
Apparel Knitting Mills,Apparel Knitting Mills,NAICS Industry,2022 NAICS,Yes
Cut and Sew Apparel Contractors ,Cut and Sew Apparel Manufacturing,NAICS Industry,2022 NAICS,Yes
Cut and Sew Apparel Manufacturing (except Contractors) ,Cut and Sew Apparel Manufacturing,NAICS Industry,2022 NAICS,Yes
Apparel Accessories and Other Apparel Manufacturing,Apparel Accessories and Other Apparel Manufacturing,NAICS Industry,2022 NAICS,Yes
Leather and Hide Tanning and Finishing,Leather and Hide Tanning and Finishing,NAICS Industry,2022 NAICS,Yes
Footwear Manufacturing,Footwear Manufacturing,NAICS Industry,2022 NAICS,Yes
Other Leather and Allied Product Manufacturing,Other Leather and Allied Product Manufacturing,NAICS Industry,2022 NAICS,Yes
Sawmills and Wood Preservation,Sawmills and Wood Preservation,NAICS Industry,2022 NAICS,Yes
"Veneer, Plywood, and Engineered Wood Product Manufacturing","Veneer, Plywood, and Engineered Wood Product Manufacturing",NAICS Industry,2022 NAICS,Yes
Millwork,Other Wood Product Manufacturing,NAICS Industry,2022 NAICS,Yes
Wood Container and Pallet Manufacturing,Other Wood Product Manufacturing,NAICS Industry,2022 NAICS,Yes
All Other Wood Product Manufacturing,Other Wood Product Manufacturing,NAICS Industry,2022 NAICS,Yes
Pulp Mills,"Pulp, Paper, and Paperboard Mills",NAICS Industry,2022 NAICS,Yes
Paper Mills,"Pulp, Paper, and Paperboard Mills",NAICS Industry,2022 NAICS,Yes
Paperboard Mills,"Pulp, Paper, and Paperboard Mills",NAICS Industry,2022 NAICS,Yes
Paperboard Container Manufacturing,Converted Paper Product Manufacturing,NAICS Industry,2022 NAICS,Yes
Paper Bag and Coated and Treated Paper Manufacturing,Converted Paper Product Manufacturing,NAICS Industry,2022 NAICS,Yes
Stationery Product Manufacturing,Converted Paper Product Manufacturing,NAICS Industry,2022 NAICS,Yes
Other Converted Paper Product Manufacturing,Converted Paper Product Manufacturing,NAICS Industry,2022 NAICS,Yes
Printing,Printing and Related Support Activities,NAICS Industry,2022 NAICS,Yes
Support Activities for Printing,Printing and Related Support Activities,NAICS Industry,2022 NAICS,Yes
Petroleum Refineries,Petroleum and Coal Products Manufacturing,NAICS Industry,2022 NAICS,Yes
"Asphalt Paving, Roofing, and Saturated Materials Manufacturing",Petroleum and Coal Products Manufacturing,NAICS Industry,2022 NAICS,Yes
Other Petroleum and Coal Products Manufacturing,Petroleum and Coal Products Manufacturing,NAICS Industry,2022 NAICS,Yes
Petrochemical Manufacturing,Basic Chemical Manufacturing,NAICS Industry,2022 NAICS,Yes
Industrial Gas Manufacturing,Basic Chemical Manufacturing,NAICS Industry,2022 NAICS,Yes
Synthetic Dye and Pigment Manufacturing,Basic Chemical Manufacturing,NAICS Industry,2022 NAICS,Yes
Other Basic Inorganic Chemical Manufacturing,Basic Chemical Manufacturing,NAICS Industry,2022 NAICS,Yes
Other Basic Organic Chemical Manufacturing,Basic Chemical Manufacturing,NAICS Industry,2022 NAICS,Yes
Resin and Synthetic Rubber Manufacturing,"Resin, Synthetic Rubber, and Artificial and Synthetic Fibers and Filaments Manufacturing",NAICS Industry,2022 NAICS,Yes
Artificial and Synthetic Fibers and Filaments Manufacturing,"Resin, Synthetic Rubber, and Artificial and Synthetic Fibers and Filaments Manufacturing",NAICS Industry,2022 NAICS,Yes
Fertilizer and Compost Manufacturing,"Pesticide, Fertilizer, and Other Agricultural Chemical Manufacturing",NAICS Industry,2022 NAICS,Yes
Pesticide and Other Agricultural Chemical Manufacturing,"Pesticide, Fertilizer, and Other Agricultural Chemical Manufacturing",NAICS Industry,2022 NAICS,Yes
Pharmaceutical and Medicine Manufacturing,Pharmaceutical and Medicine Manufacturing,NAICS Industry,2022 NAICS,Yes
Paint and Coating Manufacturing,"Paint, Coating, and Adhesive Manufacturing",NAICS Industry,2022 NAICS,Yes
Adhesive Manufacturing,"Paint, Coating, and Adhesive Manufacturing",NAICS Industry,2022 NAICS,Yes
Soap and Cleaning Compound Manufacturing,"Soap, Cleaning Compound, and Toilet Preparation Manufacturing",NAICS Industry,2022 NAICS,Yes
Toilet Preparation Manufacturing,"Soap, Cleaning Compound, and Toilet Preparation Manufacturing",NAICS Industry,2022 NAICS,Yes
Printing Ink Manufacturing,Other Chemical Product and Preparation Manufacturing,NAICS Industry,2022 NAICS,Yes
Explosives Manufacturing,Other Chemical Product and Preparation Manufacturing,NAICS Industry,2022 NAICS,Yes
All Other Chemical Product and Preparation Manufacturing,Other Chemical Product and Preparation Manufacturing,NAICS Industry,2022 NAICS,Yes
Plastics Packaging Materials and Unlaminated Film and Sheet Manufacturing,Plastics Product Manufacturing,NAICS Industry,2022 NAICS,Yes
"Plastics Pipe, Pipe Fitting, and Unlaminated Profile Shape Manufacturing",Plastics Product Manufacturing,NAICS Industry,2022 NAICS,Yes
"Laminated Plastics Plate, Sheet (except Packaging), and Shape Manufacturing",Plastics Product Manufacturing,NAICS Industry,2022 NAICS,Yes
Polystyrene Foam Product Manufacturing,Plastics Product Manufacturing,NAICS Industry,2022 NAICS,Yes
Urethane and Other Foam Product (except Polystyrene) Manufacturing,Plastics Product Manufacturing,NAICS Industry,2022 NAICS,Yes
Plastics Bottle Manufacturing,Plastics Product Manufacturing,NAICS Industry,2022 NAICS,Yes
Other Plastics Product Manufacturing,Plastics Product Manufacturing,NAICS Industry,2022 NAICS,Yes
Tire Manufacturing,Rubber Product Manufacturing,NAICS Industry,2022 NAICS,Yes
Rubber and Plastics Hoses and Belting Manufacturing,Rubber Product Manufacturing,NAICS Industry,2022 NAICS,Yes
Other Rubber Product Manufacturing,Rubber Product Manufacturing,NAICS Industry,2022 NAICS,Yes
"Pottery, Ceramics, and Plumbing Fixture Manufacturing",Clay Product and Refractory Manufacturing,NAICS Industry,2022 NAICS,Yes
Clay Building Material and Refractories Manufacturing,Clay Product and Refractory Manufacturing,NAICS Industry,2022 NAICS,Yes
Glass and Glass Product Manufacturing,Glass and Glass Product Manufacturing,NAICS Industry,2022 NAICS,Yes
Cement Manufacturing,Cement and Concrete Product Manufacturing,NAICS Industry,2022 NAICS,Yes
Ready-Mix Concrete Manufacturing,Cement and Concrete Product Manufacturing,NAICS Industry,2022 NAICS,Yes
"Concrete Pipe, Brick, and Block Manufacturing",Cement and Concrete Product Manufacturing,NAICS Industry,2022 NAICS,Yes
Other Concrete Product Manufacturing,Cement and Concrete Product Manufacturing,NAICS Industry,2022 NAICS,Yes
Lime Manufacturing,Lime and Gypsum Product Manufacturing,NAICS Industry,2022 NAICS,Yes
Gypsum Product Manufacturing,Lime and Gypsum Product Manufacturing,NAICS Industry,2022 NAICS,Yes
Abrasive Product Manufacturing,Other Nonmetallic Mineral Product Manufacturing,NAICS Industry,2022 NAICS,Yes
All Other Nonmetallic Mineral Product Manufacturing,Other Nonmetallic Mineral Product Manufacturing,NAICS Industry,2022 NAICS,Yes
Iron and Steel Mills and Ferroalloy Manufacturing,Iron and Steel Mills and Ferroalloy Manufacturing,NAICS Industry,2022 NAICS,Yes
Iron and Steel Pipe and Tube Manufacturing from Purchased Steel,Steel Product Manufacturing from Purchased Steel,NAICS Industry,2022 NAICS,Yes
Rolling and Drawing of Purchased Steel,Steel Product Manufacturing from Purchased Steel,NAICS Industry,2022 NAICS,Yes
Alumina and Aluminum Production and Processing,Alumina and Aluminum Production and Processing,NAICS Industry,2022 NAICS,Yes
Nonferrous Metal (except Aluminum) Smelting and Refining,Nonferrous Metal (except Aluminum) Production and Processing,NAICS Industry,2022 NAICS,Yes
"Copper Rolling, Drawing, Extruding, and Alloying",Nonferrous Metal (except Aluminum) Production and Processing,NAICS Industry,2022 NAICS,Yes
"Nonferrous Metal (except Copper and Aluminum) Rolling, Drawing, Extruding, and Alloying",Nonferrous Metal (except Aluminum) Production and Processing,NAICS Industry,2022 NAICS,Yes
Ferrous Metal Foundries,Foundries,NAICS Industry,2022 NAICS,Yes
Nonferrous Metal Foundries,Foundries,NAICS Industry,2022 NAICS,Yes
Forging and Stamping,Forging and Stamping,NAICS Industry,2022 NAICS,Yes
Cutlery and Handtool Manufacturing,Cutlery and Handtool Manufacturing,NAICS Industry,2022 NAICS,Yes
Plate Work and Fabricated Structural Product Manufacturing,Architectural and Structural Metals Manufacturing,NAICS Industry,2022 NAICS,Yes
Ornamental and Architectural Metal Products Manufacturing,Architectural and Structural Metals Manufacturing,NAICS Industry,2022 NAICS,Yes
Power Boiler and Heat Exchanger Manufacturing,"Boiler, Tank, and Shipping Container Manufacturing",NAICS Industry,2022 NAICS,Yes
Metal Tank (Heavy Gauge) Manufacturing,"Boiler, Tank, and Shipping Container Manufacturing",NAICS Industry,2022 NAICS,Yes
"Metal Can, Box, and Other Metal Container (Light Gauge) Manufacturing","Boiler, Tank, and Shipping Container Manufacturing",NAICS Industry,2022 NAICS,Yes
Hardware Manufacturing,Hardware Manufacturing,NAICS Industry,2022 NAICS,Yes
Spring and Wire Product Manufacturing,Spring and Wire Product Manufacturing,NAICS Industry,2022 NAICS,Yes
Machine Shops,"Machine Shops; Turned Product; and Screw, Nut, and Bolt Manufacturing",NAICS Industry,2022 NAICS,Yes
"Turned Product and Screw, Nut, and Bolt Manufacturing","Machine Shops; Turned Product; and Screw, Nut, and Bolt Manufacturing",NAICS Industry,2022 NAICS,Yes
"Coating, Engraving, Heat Treating, and Allied Activities","Coating, Engraving, Heat Treating, and Allied Activities",NAICS Industry,2022 NAICS,Yes
Metal Valve Manufacturing,Other Fabricated Metal Product Manufacturing,NAICS Industry,2022 NAICS,Yes
All Other Fabricated Metal Product Manufacturing,Other Fabricated Metal Product Manufacturing,NAICS Industry,2022 NAICS,Yes
Agricultural Implement Manufacturing,"Agriculture, Construction, and Mining Machinery Manufacturing",NAICS Industry,2022 NAICS,Yes
Construction Machinery Manufacturing,"Agriculture, Construction, and Mining Machinery Manufacturing",NAICS Industry,2022 NAICS,Yes
Mining and Oil and Gas Field Machinery Manufacturing,"Agriculture, Construction, and Mining Machinery Manufacturing",NAICS Industry,2022 NAICS,Yes
Industrial Machinery Manufacturing,Industrial Machinery Manufacturing,NAICS Industry,2022 NAICS,Yes
Commercial and Service Industry Machinery Manufacturing,Commercial and Service Industry Machinery Manufacturing,NAICS Industry,2022 NAICS,Yes
"Ventilation, Heating, Air-Conditioning, and Commercial Refrigeration Equipment Manufacturing","Ventilation, Heating, Air-Conditioning, and Commercial Refrigeration Equipment Manufacturing",NAICS Industry,2022 NAICS,Yes
Metalworking Machinery Manufacturing,Metalworking Machinery Manufacturing,NAICS Industry,2022 NAICS,Yes
"Engine, Turbine, and Power Transmission Equipment Manufacturing","Engine, Turbine, and Power Transmission Equipment Manufacturing",NAICS Industry,2022 NAICS,Yes
Pump and Compressor Manufacturing,Other General Purpose Machinery Manufacturing,NAICS Industry,2022 NAICS,Yes
Material Handling Equipment Manufacturing,Other General Purpose Machinery Manufacturing,NAICS Industry,2022 NAICS,Yes
All Other General Purpose Machinery Manufacturing,Other General Purpose Machinery Manufacturing,NAICS Industry,2022 NAICS,Yes
Computer and Peripheral Equipment Manufacturing,Computer and Peripheral Equipment Manufacturing,NAICS Industry,2022 NAICS,Yes
Telephone Apparatus Manufacturing,Communications Equipment Manufacturing,NAICS Industry,2022 NAICS,Yes
Radio and Television Broadcasting and Wireless Communications Equipment Manufacturing,Communications Equipment Manufacturing,NAICS Industry,2022 NAICS,Yes
Other Communications Equipment Manufacturing,Communications Equipment Manufacturing,NAICS Industry,2022 NAICS,Yes
Audio and Video Equipment Manufacturing,Audio and Video Equipment Manufacturing,NAICS Industry,2022 NAICS,Yes
Semiconductor and Other Electronic Component Manufacturing,Semiconductor and Other Electronic Component Manufacturing,NAICS Industry,2022 NAICS,Yes
"Navigational, Measuring, Electromedical, and Control Instruments Manufacturing","Navigational, Measuring, Electromedical, and Control Instruments Manufacturing",NAICS Industry,2022 NAICS,Yes
Manufacturing and Reproducing Magnetic and Optical Media,Manufacturing and Reproducing Magnetic and Optical Media,NAICS Industry,2022 NAICS,Yes
Electric Lighting Equipment Manufacturing,Electric Lighting Equipment Manufacturing,NAICS Industry,2022 NAICS,Yes
Small Electrical Appliance Manufacturing,Household Appliance Manufacturing,NAICS Industry,2022 NAICS,Yes
Major Household Appliance Manufacturing ,Household Appliance Manufacturing,NAICS Industry,2022 NAICS,Yes
Electrical Equipment Manufacturing,Electrical Equipment Manufacturing,NAICS Industry,2022 NAICS,Yes
Battery Manufacturing,Other Electrical Equipment and Component Manufacturing,NAICS Industry,2022 NAICS,Yes
Communication and Energy Wire and Cable Manufacturing,Other Electrical Equipment and Component Manufacturing,NAICS Industry,2022 NAICS,Yes
Wiring Device Manufacturing,Other Electrical Equipment and Component Manufacturing,NAICS Industry,2022 NAICS,Yes
All Other Electrical Equipment and Component Manufacturing,Other Electrical Equipment and Component Manufacturing,NAICS Industry,2022 NAICS,Yes
Automobile and Light Duty Motor Vehicle Manufacturing,Motor Vehicle Manufacturing,NAICS Industry,2022 NAICS,Yes
Heavy Duty Truck Manufacturing,Motor Vehicle Manufacturing,NAICS Industry,2022 NAICS,Yes
Motor Vehicle Body and Trailer Manufacturing,Motor Vehicle Body and Trailer Manufacturing,NAICS Industry,2022 NAICS,Yes
Motor Vehicle Gasoline Engine and Engine Parts Manufacturing,Motor Vehicle Parts Manufacturing,NAICS Industry,2022 NAICS,Yes
Motor Vehicle Electrical and Electronic Equipment Manufacturing,Motor Vehicle Parts Manufacturing,NAICS Industry,2022 NAICS,Yes
Motor Vehicle Steering and Suspension Components (except Spring) Manufacturing,Motor Vehicle Parts Manufacturing,NAICS Industry,2022 NAICS,Yes
Motor Vehicle Brake System Manufacturing,Motor Vehicle Parts Manufacturing,NAICS Industry,2022 NAICS,Yes
Motor Vehicle Transmission and Power Train Parts Manufacturing,Motor Vehicle Parts Manufacturing,NAICS Industry,2022 NAICS,Yes
Motor Vehicle Seating and Interior Trim Manufacturing,Motor Vehicle Parts Manufacturing,NAICS Industry,2022 NAICS,Yes
Motor Vehicle Metal Stamping,Motor Vehicle Parts Manufacturing,NAICS Industry,2022 NAICS,Yes
Other Motor Vehicle Parts Manufacturing,Motor Vehicle Parts Manufacturing,NAICS Industry,2022 NAICS,Yes
