fk_naics_industry,code,concept_name,source,standard_semantic_hierarchy
Political Organizations ,81394,NAICS Industry Code,2022 NAICS,No
"Other Similar Organizations (except Business, Professional, Labor, and Political Organizations) ",81399,NAICS Industry Code,2022 NAICS,No
Private Households,81411,NAICS Industry Code,2022 NAICS,No
Executive Offices ,92111,NAICS Industry Code,2022 NAICS,No
Legislative Bodies ,92112,NAICS Industry Code,2022 NAICS,No
Public Finance Activities ,92113,NAICS Industry Code,2022 NAICS,No
"Executive and Legislative Offices, Combined ",92114,NAICS Industry Code,2022 NAICS,No
American Indian and Alaska Native Tribal Governments ,92115,NAICS Industry Code,2022 NAICS,No
Other General Government Support ,92119,NAICS Industry Code,2022 NAICS,No
Courts ,92211,NAICS Industry Code,2022 NAICS,No
Police Protection ,92212,NAICS Industry Code,2022 NAICS,No
Legal Counsel and Prosecution ,92213,NAICS Industry Code,2022 NAICS,No
Correctional Institutions ,92214,NAICS Industry Code,2022 NAICS,No
Parole Offices and Probation Offices ,92215,NAICS Industry Code,2022 NAICS,No
Fire Protection ,92216,NAICS Industry Code,2022 NAICS,No
"Other Justice, Public Order, and Safety Activities ",92219,NAICS Industry Code,2022 NAICS,No
Administration of Education Programs ,92311,NAICS Industry Code,2022 NAICS,No
Administration of Public Health Programs ,92312,NAICS Industry Code,2022 NAICS,No
"Administration of Human Resource Programs (except Education, Public Health, and Veterans' Affairs Programs) ",92313,NAICS Industry Code,2022 NAICS,No
Administration of Veterans' Affairs ,92314,NAICS Industry Code,2022 NAICS,No
Administration of Air and Water Resource and Solid Waste Management Programs ,92411,NAICS Industry Code,2022 NAICS,No
Administration of Conservation Programs ,92412,NAICS Industry Code,2022 NAICS,No
Administration of Housing Programs ,92511,NAICS Industry Code,2022 NAICS,No
Administration of Urban Planning and Community and Rural Development ,92512,NAICS Industry Code,2022 NAICS,No
Administration of General Economic Programs ,92611,NAICS Industry Code,2022 NAICS,No
Regulation and Administration of Transportation Programs ,92612,NAICS Industry Code,2022 NAICS,No
"Regulation and Administration of Communications, Electric, Gas, and Other Utilities ",92613,NAICS Industry Code,2022 NAICS,No
Regulation of Agricultural Marketing and Commodities ,92614,NAICS Industry Code,2022 NAICS,No
"Regulation, Licensing, and Inspection of Miscellaneous Commercial Sectors ",92615,NAICS Industry Code,2022 NAICS,No
Space Research and Technology ,92711,NAICS Industry Code,2022 NAICS,No
National Security ,92811,NAICS Industry Code,2022 NAICS,No
International Affairs ,92812,NAICS Industry Code,2022 NAICS,No
