Title_naics_ind,Title_ind_group
All Other Personal Services ,Other Personal Services 
Religious Organizations ,Religious Organizations 
Grantmaking and Giving Services ,Grantmaking and Giving Services 
Social Advocacy Organizations ,Social Advocacy Organizations 
Civic and Social Organizations ,Civic and Social Organizations 
Business Associations ,"Business, Professional, Labor, Political, and Similar Organizations "
Professional Organizations ,"Business, Professional, Labor, Political, and Similar Organizations "
Labor Unions and Similar Labor Organizations ,"Business, Professional, Labor, Political, and Similar Organizations "
Political Organizations ,"Business, Professional, Labor, Political, and Similar Organizations "
"Other Similar Organizations (except Business, Professional, Labor, and Political Organizations) ","Business, Professional, Labor, Political, and Similar Organizations "
Private Households,Private Households
Executive Offices ,"Executive, Legislative, and Other General Government Support "
Legislative Bodies ,"Executive, Legislative, and Other General Government Support "
Public Finance Activities ,"Executive, Legislative, and Other General Government Support "
"Executive and Legislative Offices, Combined ","Executive, Legislative, and Other General Government Support "
American Indian and Alaska Native Tribal Governments ,"Executive, Legislative, and Other General Government Support "
Other General Government Support ,"Executive, Legislative, and Other General Government Support "
Courts ,"Justice, Public Order, and Safety Activities "
Police Protection ,"Justice, Public Order, and Safety Activities "
Legal Counsel and Prosecution ,"Justice, Public Order, and Safety Activities "
Correctional Institutions ,"Justice, Public Order, and Safety Activities "
Parole Offices and Probation Offices ,"Justice, Public Order, and Safety Activities "
Fire Protection ,"Justice, Public Order, and Safety Activities "
"Other Justice, Public Order, and Safety Activities ","Justice, Public Order, and Safety Activities "
Administration of Education Programs ,Administration of Human Resource Programs 
Administration of Public Health Programs ,Administration of Human Resource Programs 
"Administration of Human Resource Programs (except Education, Public Health, and Veterans' Affairs Programs) ",Administration of Human Resource Programs 
Administration of Veterans' Affairs ,Administration of Human Resource Programs 
Administration of Air and Water Resource and Solid Waste Management Programs ,Administration of Environmental Quality Programs 
Administration of Conservation Programs ,Administration of Environmental Quality Programs 
Administration of Housing Programs ,"Administration of Housing Programs, Urban Planning, and Community Development "
Administration of Urban Planning and Community and Rural Development ,"Administration of Housing Programs, Urban Planning, and Community Development "
Administration of General Economic Programs ,Administration of Economic Programs 
Regulation and Administration of Transportation Programs ,Administration of Economic Programs 
"Regulation and Administration of Communications, Electric, Gas, and Other Utilities ",Administration of Economic Programs 
Regulation of Agricultural Marketing and Commodities ,Administration of Economic Programs 
"Regulation, Licensing, and Inspection of Miscellaneous Commercial Sectors ",Administration of Economic Programs 
Space Research and Technology ,Space Research and Technology 
National Security ,National Security and International Affairs 
International Affairs ,National Security and International Affairs 
