code,fk_name,parent,concept_name,source,standard_semantic_hierarchy
11-1000,Top Executives,None,Minor Group SOC Code,2018 SOC,No
11-2000,"Advertising, Marketing, Promotions, Public Relations, and Sales Managers",None,Minor Group SOC Code,2018 SOC,No
11-3000,Operations Specialties Managers,None,Minor Group SOC Code,2018 SOC,No
11-9000,Other Management Occupations,None,Minor Group SOC Code,2018 SOC,No
13-1000,Business Operations Specialists,None,Minor Group SOC Code,2018 SOC,No
13-2000,Financial Specialists,None,Minor Group SOC Code,2018 SOC,No
15-1200,Computer Occupations,None,Minor Group SOC Code,2018 SOC,No
15-2000,Mathematical Science Occupations,None,Minor Group SOC Code,2018 SOC,No
17-1000,"Architects, Surveyors, and Cartographers",None,Minor Group SOC Code,2018 SOC,No
17-2000,Engineers,None,Minor Group SOC Code,2018 SOC,No
17-3000,"Drafters, Engineering Technicians, and Mapping Technicians",None,Minor Group SOC Code,2018 SOC,No
19-1000,Life Scientists,None,Minor Group SOC Code,2018 SOC,No
19-2000,Physical Scientists,None,Minor Group SOC Code,2018 SOC,No
19-3000,Social Scientists and Related Workers,None,Minor Group SOC Code,2018 SOC,No
19-4000,"Life, Physical, and Social Science Technicians",None,Minor Group SOC Code,2018 SOC,No
19-5000,Occupational Health and Safety Specialists and Technicians,None,Minor Group SOC Code,2018 SOC,No
21-1000,"Counselors, Social Workers, and Other Community and Social Service Specialists",None,Minor Group SOC Code,2018 SOC,No
21-2000,Religious Workers,None,Minor Group SOC Code,2018 SOC,No
23-1000,"Lawyers, Judges, and Related Workers",None,Minor Group SOC Code,2018 SOC,No
23-2000,Legal Support Workers,None,Minor Group SOC Code,2018 SOC,No
25-1000,Postsecondary Teachers,None,Minor Group SOC Code,2018 SOC,No
25-2000,"Preschool, Elementary, Middle, Secondary, and Special Education Teachers",None,Minor Group SOC Code,2018 SOC,No
25-3000,Other Teachers and Instructors,None,Minor Group SOC Code,2018 SOC,No
25-4000,"Librarians, Curators, and Archivists",None,Minor Group SOC Code,2018 SOC,No
25-9000,Other Educational Instruction and Library Occupations,None,Minor Group SOC Code,2018 SOC,No
27-1000,Art and Design Workers,None,Minor Group SOC Code,2018 SOC,No
27-2000,"Entertainers and Performers, Sports and Related Workers",None,Minor Group SOC Code,2018 SOC,No
27-3000,Media and Communication Workers,None,Minor Group SOC Code,2018 SOC,No
27-4000,Media and Communication Equipment Workers,None,Minor Group SOC Code,2018 SOC,No
29-1000,Healthcare Diagnosing or Treating Practitioners,None,Minor Group SOC Code,2018 SOC,No
29-2000,Health Technologists and Technicians,None,Minor Group SOC Code,2018 SOC,No
29-9000,Other Healthcare Practitioners and Technical Occupations,None,Minor Group SOC Code,2018 SOC,No
31-1100,"Home Health and Personal Care Aides; and Nursing Assistants, Orderlies, and Psychiatric Aides",None,Minor Group SOC Code,2018 SOC,No
31-2000,Occupational Therapy and Physical Therapist Assistants and Aides,None,Minor Group SOC Code,2018 SOC,No
31-9000,Other Healthcare Support Occupations,None,Minor Group SOC Code,2018 SOC,No
33-1000,Supervisors of Protective Service Workers,None,Minor Group SOC Code,2018 SOC,No
33-2000,Firefighting and Prevention Workers,None,Minor Group SOC Code,2018 SOC,No
33-3000,Law Enforcement Workers,None,Minor Group SOC Code,2018 SOC,No
33-9000,Other Protective Service Workers,None,Minor Group SOC Code,2018 SOC,No
35-1000,Supervisors of Food Preparation and Serving Workers,None,Minor Group SOC Code,2018 SOC,No
35-2000,Cooks and Food Preparation Workers,None,Minor Group SOC Code,2018 SOC,No
35-3000,Food and Beverage Serving Workers,None,Minor Group SOC Code,2018 SOC,No
35-9000,Other Food Preparation and Serving Related Workers,None,Minor Group SOC Code,2018 SOC,No
37-1000,Supervisors of Building and Grounds Cleaning and Maintenance Workers,None,Minor Group SOC Code,2018 SOC,No
37-2000,Building Cleaning and Pest Control Workers,None,Minor Group SOC Code,2018 SOC,No
37-3000,Grounds Maintenance Workers,None,Minor Group SOC Code,2018 SOC,No
39-1000,Supervisors of Personal Care and Service Workers,None,Minor Group SOC Code,2018 SOC,No
39-2000,Animal Care and Service Workers,None,Minor Group SOC Code,2018 SOC,No
39-3000,Entertainment Attendants and Related Workers,None,Minor Group SOC Code,2018 SOC,No
39-4000,Funeral Service Workers,None,Minor Group SOC Code,2018 SOC,No
39-5000,Personal Appearance Workers,None,Minor Group SOC Code,2018 SOC,No
39-6000,"Baggage Porters, Bellhops, and Concierges",None,Minor Group SOC Code,2018 SOC,No
39-7000,Tour and Travel Guides,None,Minor Group SOC Code,2018 SOC,No
39-9000,Other Personal Care and Service Workers,None,Minor Group SOC Code,2018 SOC,No
41-1000,Supervisors of Sales Workers,None,Minor Group SOC Code,2018 SOC,No
41-2000,Retail Sales Workers,None,Minor Group SOC Code,2018 SOC,No
41-3000,"Sales Representatives, Services",None,Minor Group SOC Code,2018 SOC,No
41-4000,"Sales Representatives, Wholesale and Manufacturing",None,Minor Group SOC Code,2018 SOC,No
41-9000,Other Sales and Related Workers,None,Minor Group SOC Code,2018 SOC,No
43-1000,Supervisors of Office and Administrative Support Workers,None,Minor Group SOC Code,2018 SOC,No
43-2000,Communications Equipment Operators,None,Minor Group SOC Code,2018 SOC,No
43-3000,Financial Clerks,None,Minor Group SOC Code,2018 SOC,No
43-4000,Information and Record Clerks,None,Minor Group SOC Code,2018 SOC,No
43-5000,"Material Recording, Scheduling, Dispatching, and Distributing Workers",None,Minor Group SOC Code,2018 SOC,No
43-6000,Secretaries and Administrative Assistants,None,Minor Group SOC Code,2018 SOC,No
43-9000,Other Office and Administrative Support Workers,None,Minor Group SOC Code,2018 SOC,No
45-1000,"Supervisors of Farming, Fishing, and Forestry Workers",None,Minor Group SOC Code,2018 SOC,No
45-2000,Agricultural Workers,None,Minor Group SOC Code,2018 SOC,No
45-3000,Fishing and Hunting Workers,None,Minor Group SOC Code,2018 SOC,No
45-4000,"Forest, Conservation, and Logging Workers",None,Minor Group SOC Code,2018 SOC,No
47-1000,Supervisors of Construction and Extraction Workers,None,Minor Group SOC Code,2018 SOC,No
47-2000,Construction Trades Workers,None,Minor Group SOC Code,2018 SOC,No
47-3000,"Helpers, Construction Trades",None,Minor Group SOC Code,2018 SOC,No
47-4000,Other Construction and Related Workers,None,Minor Group SOC Code,2018 SOC,No
47-5000,Extraction Workers,None,Minor Group SOC Code,2018 SOC,No
49-1000,"Supervisors of Installation, Maintenance, and Repair Workers",None,Minor Group SOC Code,2018 SOC,No
49-2000,"Electrical and Electronic Equipment Mechanics, Installers, and Repairers",None,Minor Group SOC Code,2018 SOC,No
49-3000,"Vehicle and Mobile Equipment Mechanics, Installers, and Repairers",None,Minor Group SOC Code,2018 SOC,No
49-9000,"Other Installation, Maintenance, and Repair Occupations",None,Minor Group SOC Code,2018 SOC,No
51-1000,Supervisors of Production Workers,None,Minor Group SOC Code,2018 SOC,No
51-2000,Assemblers and Fabricators,None,Minor Group SOC Code,2018 SOC,No
51-3000,Food Processing Workers,None,Minor Group SOC Code,2018 SOC,No
51-4000,Metal Workers and Plastic Workers,None,Minor Group SOC Code,2018 SOC,No
51-5100,Printing Workers,None,Minor Group SOC Code,2018 SOC,No
51-6000,"Textile, Apparel, and Furnishings Workers",None,Minor Group SOC Code,2018 SOC,No
51-7000,Woodworkers,None,Minor Group SOC Code,2018 SOC,No
51-8000,Plant and System Operators,None,Minor Group SOC Code,2018 SOC,No
51-9000,Other Production Occupations,None,Minor Group SOC Code,2018 SOC,No
53-1000,Supervisors of Transportation and Material Moving Workers,None,Minor Group SOC Code,2018 SOC,No
53-2000,Air Transportation Workers,None,Minor Group SOC Code,2018 SOC,No
53-3000,Motor Vehicle Operators,None,Minor Group SOC Code,2018 SOC,No
53-4000,Rail Transportation Workers,None,Minor Group SOC Code,2018 SOC,No
53-5000,Water Transportation Workers,None,Minor Group SOC Code,2018 SOC,No
53-6000,Other Transportation Workers,None,Minor Group SOC Code,2018 SOC,No
53-7000,Material Moving Workers,None,Minor Group SOC Code,2018 SOC,No
55-1000,Military Officer Special and Tactical Operations Leaders,None,Minor Group SOC Code,2018 SOC,No
55-2000,First-Line Enlisted Military Supervisors,None,Minor Group SOC Code,2018 SOC,No
55-3000,Military Enlisted Tactical Operations and Air/Weapons Specialists and Crew Members,None,Minor Group SOC Code,2018 SOC,No
